{
  "schema_version": 1,
  "canonical_profile": "broker-cjson-v1",
  "max_snapshot_age_seconds": 90,
  "max_source_skew_seconds": 12,
  "maximum_swap_in_bytes_per_second": 262144,
  "required_sources": ["backups", "controllers", "inventory", "telemetry"],
  "environments": [
    {
      "id": "foundation",
      "display_name": "Foundation services",
      "class": "core",
      "user_visible": false,
      "host_affinity": "node-cobalt",
      "reserved_memory_bytes": 7516192768,
      "minimum_root_free_bytes": 9663676416,
      "cohort": ["foundation-router", "foundation-metrics"],
      "exclusive_with": [],
      "shares_cohort_with": [],
      "required_networks": ["platform-fabric"],
      "can_donate_to": [],
      "coexists_with": [],
      "controller": "foundation-observer",
      "cleanup_adapter": "no-cleanup",
      "default_lease_seconds": 2700,
      "maximum_lease_seconds": 5400,
      "backup_required": false,
      "donor_sets": []
    },
    {
      "id": "batch-orchestrator",
      "display_name": "Batch orchestration workspace",
      "class": "application",
      "user_visible": false,
      "host_affinity": "node-cobalt",
      "reserved_memory_bytes": 9663676416,
      "minimum_root_free_bytes": 9663676416,
      "cohort": ["batch-runner"],
      "exclusive_with": [],
      "shares_cohort_with": [],
      "required_networks": ["platform-fabric"],
      "can_donate_to": ["security-range", "desktop-range"],
      "coexists_with": ["foundation"],
      "controller": "workspace-controller",
      "cleanup_adapter": "workspace-cleanup",
      "default_lease_seconds": 3300,
      "maximum_lease_seconds": 13500,
      "backup_required": true,
      "donor_sets": []
    },
    {
      "id": "archive-indexer",
      "display_name": "Archive indexing workspace",
      "class": "application",
      "user_visible": false,
      "host_affinity": "node-cobalt",
      "reserved_memory_bytes": 7516192768,
      "minimum_root_free_bytes": 9663676416,
      "cohort": ["archive-worker"],
      "exclusive_with": [],
      "shares_cohort_with": [],
      "required_networks": ["platform-fabric"],
      "can_donate_to": ["security-range", "desktop-range"],
      "coexists_with": ["foundation"],
      "controller": "workspace-controller",
      "cleanup_adapter": "workspace-cleanup",
      "default_lease_seconds": 3300,
      "maximum_lease_seconds": 13500,
      "backup_required": true,
      "donor_sets": []
    },
    {
      "id": "vision-workbench",
      "display_name": "Vision workbench",
      "class": "application",
      "user_visible": true,
      "host_affinity": "node-cobalt",
      "reserved_memory_bytes": 15032385536,
      "minimum_root_free_bytes": 9663676416,
      "cohort": ["vision-worker"],
      "exclusive_with": [],
      "shares_cohort_with": [],
      "required_networks": ["platform-fabric"],
      "can_donate_to": ["security-range", "desktop-range"],
      "coexists_with": ["foundation", "batch-orchestrator", "archive-indexer"],
      "controller": "workspace-controller",
      "cleanup_adapter": "workspace-cleanup",
      "default_lease_seconds": 6900,
      "maximum_lease_seconds": 19800,
      "backup_required": true,
      "donor_sets": []
    },
    {
      "id": "cluster-blue",
      "display_name": "Cluster administration exam A",
      "class": "exam",
      "user_visible": true,
      "host_affinity": "node-amber",
      "reserved_memory_bytes": 22548578304,
      "minimum_root_free_bytes": 9663676416,
      "cohort": ["cluster-control", "cluster-worker-one", "cluster-worker-two"],
      "exclusive_with": ["cluster-green"],
      "shares_cohort_with": ["cluster-green"],
      "required_networks": ["assessment-fabric"],
      "can_donate_to": [],
      "coexists_with": ["foundation", "batch-orchestrator", "archive-indexer", "vision-workbench"],
      "controller": "cluster-exam-controller",
      "cleanup_adapter": "cluster-exam-cleanup",
      "default_lease_seconds": 8100,
      "maximum_lease_seconds": 11700,
      "backup_required": false,
      "donor_sets": []
    },
    {
      "id": "cluster-green",
      "display_name": "Cluster administration exam B",
      "class": "exam",
      "user_visible": true,
      "host_affinity": "node-amber",
      "reserved_memory_bytes": 25769803776,
      "minimum_root_free_bytes": 9663676416,
      "cohort": ["cluster-control", "cluster-worker-one", "cluster-worker-two"],
      "exclusive_with": ["cluster-blue"],
      "shares_cohort_with": ["cluster-blue"],
      "required_networks": ["assessment-fabric"],
      "can_donate_to": [],
      "coexists_with": ["foundation", "batch-orchestrator", "archive-indexer", "vision-workbench"],
      "controller": "cluster-exam-controller",
      "cleanup_adapter": "cluster-exam-cleanup",
      "default_lease_seconds": 9900,
      "maximum_lease_seconds": 13500,
      "backup_required": false,
      "donor_sets": []
    },
    {
      "id": "linux-blue",
      "display_name": "Linux operations exam",
      "class": "exam",
      "user_visible": true,
      "host_affinity": "node-amber",
      "reserved_memory_bytes": 17179869184,
      "minimum_root_free_bytes": 9663676416,
      "cohort": ["linux-node-one", "linux-node-two"],
      "exclusive_with": [],
      "shares_cohort_with": [],
      "required_networks": ["assessment-fabric"],
      "can_donate_to": [],
      "coexists_with": ["foundation", "batch-orchestrator", "archive-indexer", "vision-workbench"],
      "controller": "linux-exam-controller",
      "cleanup_adapter": "linux-exam-cleanup",
      "default_lease_seconds": 8400,
      "maximum_lease_seconds": 13200,
      "backup_required": false,
      "donor_sets": []
    },
    {
      "id": "automation-blue",
      "display_name": "Configuration automation exam",
      "class": "exam",
      "user_visible": true,
      "host_affinity": "node-amber",
      "reserved_memory_bytes": 16106127360,
      "minimum_root_free_bytes": 9663676416,
      "cohort": ["automation-controller", "automation-target-one", "automation-target-two"],
      "exclusive_with": [],
      "shares_cohort_with": [],
      "required_networks": ["assessment-fabric"],
      "can_donate_to": [],
      "coexists_with": ["foundation", "batch-orchestrator", "archive-indexer", "vision-workbench"],
      "controller": "automation-exam-controller",
      "cleanup_adapter": "automation-exam-cleanup",
      "default_lease_seconds": 12600,
      "maximum_lease_seconds": 17100,
      "backup_required": false,
      "donor_sets": []
    },
    {
      "id": "security-range",
      "display_name": "Network security range",
      "class": "exam",
      "user_visible": true,
      "host_affinity": "node-cobalt",
      "reserved_memory_bytes": 46170898432,
      "minimum_root_free_bytes": 11811160064,
      "cohort": ["security-gateway", "security-directory", "security-client-one", "security-client-two", "security-target-one", "security-target-two", "security-analyst"],
      "placements": [
        {
          "node": "node-cobalt",
          "reserved_memory_bytes": 37580963840,
          "minimum_root_free_bytes": 11811160064,
          "cohort": ["security-gateway", "security-directory", "security-client-one", "security-client-two", "security-target-one"]
        },
        {
          "node": "node-amber",
          "reserved_memory_bytes": 8589934592,
          "minimum_root_free_bytes": 9663676416,
          "cohort": ["security-target-two", "security-analyst"]
        }
      ],
      "exclusive_with": [],
      "shares_cohort_with": [],
      "required_networks": ["range-fabric"],
      "can_donate_to": [],
      "coexists_with": ["foundation"],
      "controller": "security-range-controller",
      "cleanup_adapter": "security-range-cleanup",
      "default_lease_seconds": 13200,
      "maximum_lease_seconds": 20700,
      "backup_required": false,
      "donor_sets": [
        {
          "id": "security-vision-release",
          "donors": ["vision-workbench"],
          "adapter": "reviewed-range-capacity",
          "requires_fresh_backup": true,
          "service_impact": 24,
          "restore_seconds": 210,
          "dependencies": 1
        },
        {
          "id": "security-workspace-release",
          "donors": ["batch-orchestrator", "archive-indexer", "vision-workbench"],
          "adapter": "reviewed-range-capacity",
          "requires_fresh_backup": true,
          "service_impact": 63,
          "restore_seconds": 510,
          "dependencies": 3
        }
      ]
    },
    {
      "id": "desktop-range",
      "display_name": "Enterprise desktop practice range",
      "class": "application",
      "user_visible": true,
      "host_affinity": "node-cobalt",
      "reserved_memory_bytes": 55834574848,
      "minimum_root_free_bytes": 11811160064,
      "cohort": ["desktop-directory", "desktop-client-one", "desktop-client-two", "desktop-management", "desktop-utility-one", "desktop-utility-two"],
      "placements": [
        {
          "node": "node-cobalt",
          "reserved_memory_bytes": 42949672960,
          "minimum_root_free_bytes": 11811160064,
          "cohort": ["desktop-directory", "desktop-client-one", "desktop-client-two", "desktop-management"]
        },
        {
          "node": "node-amber",
          "reserved_memory_bytes": 12884901888,
          "minimum_root_free_bytes": 9663676416,
          "cohort": ["desktop-utility-one", "desktop-utility-two"]
        }
      ],
      "exclusive_with": [],
      "shares_cohort_with": [],
      "required_networks": ["practice-fabric"],
      "can_donate_to": [],
      "coexists_with": ["foundation"],
      "controller": "desktop-range-controller",
      "cleanup_adapter": "desktop-range-cleanup",
      "default_lease_seconds": 10200,
      "maximum_lease_seconds": 19800,
      "backup_required": false,
      "donor_sets": [
        {
          "id": "desktop-workspace-freeze",
          "donors": ["batch-orchestrator", "archive-indexer"],